"img-fit-cover src","entity_localized_name","anime_tag","anime_summary","anime_story","steam-site-name","steam-site-name 2","steam-site-name 3","anime_tag 2","anime_tag 3","scormem-item","scormem-item 2","image_path"
"https://static.acgsecrets.hk/img/85/852346dc10207e1a16d28c0d964dfcf7/129544d9ca229ce3af5afd06287535105874187d64835bcbc2775da4b6217f3c.jpg","歡迎來到實力至上主義的教室 3rd Season","戲劇","其他名稱：歡迎來到實力至上主義的教室 第三季、歡迎來到實力至上主義的教室S3、Youkoso Jitsuryoku Shijou Shugi no Kyoushitsu e 3rd Season、Classroom of the Elite Season 3、欢迎来到实力至上主义的教室 3rd Season、欢迎来到实力至上主义的教室 第三季、欢迎来到实力至上主义的教室S3","隨著第三學期開始，高度育成高中所有學生都被帶去了深山裡的校舍。此次施行的特別考試名為「混合合宿」。一個學年按照男女各分六組。而且據說二年級、三年級也將和各個小組會合。最終，全體學生所隸屬的平均分數前三高的組別，學校將贈予獎勵點數。另一方面，最後一名的小組負責人則會退學。大家都很害怕有著退學懲罰的特別考試。分組方式完全交由學生決定。和過去彼此應是敵人的班級聯手所產生的情感糾葛，將會掀起風波！甚至連新任學生會長南雲，以及那個高圓寺似乎都有動作──！","木棉花YouTube","viu.com","木棉花YouTube","","","7.95","487K","anime_data/images/歡迎來到實力至上主義的教室 3rd Season.jpg"
"https://static.acgsecrets.hk/img/10/1013a32490d9e7a09aef743abd00dada/5a592d201e7cc9052659137c5b448d1778274693e1e27344538f8789468c9090.jpg","迷宮飯","喜劇","其他名稱：Dungeon Meshi、Delicious in Dungeon、迷宫饭","萊歐斯一行人終於進到迷宮深處，卻遭到巨龍襲擊，失去了金錢與糧食。決心再次挑戰的他們若不解決糧食問題，半路便會餓死。此時，萊歐斯提出「吃魔物」的想法。不止史萊姆、寶箱怪，甚至連龍都打算吃下肚！？於是，一行人便展開了一邊冒險一邊料理魔物的……美食探險！？冒險家們是否能平安抵達終點，還是半路就會吃壞肚子呢？","Netflix","Netflix","Bilibili","奇幻","","8.6","520K","anime_data/images/迷宮飯.jpg"
"https://static.acgsecrets.hk/img/16/160b855afdd01ece6d16e6b19938d1dd/653e88f1476224423d4a73a1fcdf67cebd2b6dcccbdcc69ab4eafecdacfac46f.png","我獨自升級","動作","其他名稱：Ore dake Level Up na Ken、Solo Leveling、我独自升级","十幾年前，世界上出現了連接異次元與這個世界的通道「傳送門」，而人群中還出現了覺醒之人。 在傳送門裡狩獵魔物的覺醒者們，又被稱為「獵人」。然而並不是所有獵人都很強。我是個E級獵人。我是連在低級地下城裡都得拼命才能死裡逃生的「人類最弱兵器」。","Netflix","viu.com","Netflix","冒險","奇幻","8.23","1.0M","anime_data/images/我獨自升級.png"
"https://static.acgsecrets.hk/img/77/773fa3f0035de89ba7a26335a1cfa4d4/34aa16ff018111bd8418a345ebda33ece0f83e1777bf0df949523aa817725a83.jpg","肌肉魔法使-MASHLE- 神覺者候補選拔試驗篇","動作","其他名稱：肌肉魔法使-MASHLE- 第2季、物理魔法使馬修 第2季、MASHLE Kami Shinkakusha Kouho Senbatsu Shiken-hen、MASHLE: MAGIC AND MUSCLES The Divine Visionary Candidate Exam Arc、MASHLE: MAGIC AND MUSCLES Season 2、物理魔法使马修 第2季、肌肉魔法使-MASHLE- 神觉者候补选拔试验篇","","Bilibili","Netflix","viu.com","喜劇","奇幻","7.79","468K","anime_data/images/肌肉魔法使-MASHLE- 神覺者候補選拔試驗篇.jpg"
"https://static.acgsecrets.hk/img/9e/9e1a7783d3d01e245e8d430d05bdcb4d/d437e9cc187aa7d4bffe611f09c5347a24a79a0324f3ebc1f117a12167f7e85d.jpg","Metallic Rouge","動作","其他名稱：Metallic Rouge、金屬口紅、金属口红","在一個人類和人造人共存的世界──人造人少女・ルジュ在火星，與她的夥伴ナオミ執行一項任務。該任務是，「殺害與政府敵對的9名人造人」。人造人少女・ルジュ的戰鬥故事就此展開──。","Bilibili","Ani-One YouTube","Bilibili","科幻","","6.2","113K","anime_data/images/Metallic Rouge.jpg"
"https://static.acgsecrets.hk/img/f4/f4efb8d176ab64e00f74120cea504baa/e7f0c1e4b68759307099c7679ae08d74e02263b243ccd754b7a2a639f41b74b0.jpg","我內心的糟糕念頭 第2季","喜劇","其他名稱：我心裡危險的東西 第2季、Boku no Kokoro no Yabai Yatsu 2nd Season、The Dangers in My Heart Season 2、我心里危险的东西 第2季、我内心的糟糕念头 第2季","深陷中二病的陰沉少年市川京太郎，和班上的紅人山田杏奈。不像一般的美少女，山田總是展現出出人意表的行為，讓市川總是不由自主地關注她。山田不知是否意識到市川的情感，但她總是開朗地靠近他。這兩人原本應該生活在完全不同的世界中，但兩人之間的距離卻逐步縮小……","Ani-One YouTube","Ani-One YouTube","巴哈姆特動畫瘋","浪漫","","8.73","279K","anime_data/images/我內心的糟糕念頭 第2季.jpg"
"https://static.acgsecrets.hk/img/f9/f9b9f35e4254f84d2eadcb81a1a85e32/0d0c68e906bbfbd464571dd5204d0881a82866728b87db579e262367b56f2100.jpg","月光下的異世界之旅 第二幕","動作","其他名稱：Tsuki ga Michibiku Isekai Douchuu 2nd Season、TSUKIMICHI -Moonlit Fantasy- Season 2、月光下的异世界之旅 第二幕","因故被異世界召喚的「深澄 真」，本應成為「勇者」對抗魔族，卻被女神詬病「樣子醜」，使他失去勇者的身份，被丟棄在無邊無際的荒野中。在這荒野中，真與龍的「巴」、蜘蛛的「澪」、還有死靈的「識」結為夥伴。這群人來到了被稱為「學園都市」的ロッツガルド。真原本打算作為學生入學，卻不小心報名了教員招聘考試，並一次過關？！","Ani-One YouTube","Ani-One YouTube","巴哈姆特動畫瘋","冒險","喜劇","7.84","308K","anime_data/images/月光下的異世界之旅 第二幕.jpg"
"https://static.acgsecrets.hk/img/97/9733a8cbc168eb587493923e6c33f0c6/a3312ed49a1eb1a52e6ce6ea6eb4700c001f161f9e9179e79145eede415783da.jpg","戰國妖狐","動作","其他名稱：Sengoku Youko、Warring States Youko、战国妖狐、Sengoku Youko: Yonaoshi Kyoudai-hen","時間為戰國時代，世上具有各種魑魅魍魎、異形妖怪等等總稱為「闇」的存在。喜歡人類的闇‧妖狐小玉，以及厭惡人類的仙道‧迅火，姊弟兩人進行著掃蕩罪惡的救世活動。另外還有一群專門對付闇的僧侶‧斷怪眾，他們以不人道的方式進行人體改造，迅火等人與他們產生激烈衝突……！人類當中也有壞人，非人類的存在也不見得都是邪惡的，迅火因過去的事而極其討厭人類，但在旅程當中，也逐漸目睹到人類善良的一面，他是否能有所轉變呢……？","Ani-One YouTube","Netflix","Ani-One YouTube","冒險","戲劇","6.99","67K","anime_data/images/戰國妖狐.jpg"
"https://static.acgsecrets.hk/img/0c/0c96f4caa6b3cb97c43cc40e1ea31e05/5f114d4c0d72f2de99d34c8fd1412815b78ce5f1ce707386a997905645d99d1a.jpg","公主殿下，「拷問」的時間到了","喜劇","其他名稱：公主大人，接下來是「拷問」時間、公主大人的「拷問」時間、Hime-sama ""Goumon"" no Jikan desu、It's Time for ""Interrogation"", Princess!、'Tis Time for ""Torture,"" Princess、公主大人，接下来是“拷问”时间、公主殿下，「拷问」的时间到了、公主大人的“拷问”时间","國王軍與魔王軍展開衝突已有數載。既是王女也是國王軍第三騎士團「騎士團長」的公主，如今成為了魔王軍的階下囚！而等待公主的則是超乎想像的各種拷問──！？最殘酷的拷問時間即將開始！！","Ani-One YouTube","Ani-One YouTube","巴哈姆特動畫瘋","奇幻","","7.22","77K","anime_data/images/公主殿下，「拷問」的時間到了.jpg"
"https://static.acgsecrets.hk/img/dc/dc7a5669ad9976e4aa42b57aa794c46e/3673fa007e3aead73c3b31e6286313be3a74c9b986915e04df9c8dee362c6b9a.jpg","休假的壞人先生","喜劇","其他名稱：休假日的壞人先生、Kyuujitsu no Warumono-san、Mr. Villain's Day Off、休假日的坏人先生、休假的坏人先生","在企圖侵略地球的邪惡組織中，被稱為「將軍」的他，過著與地球防衛組織「戰隊」展開激烈戰鬥的每一天！但今天是假日，進入休息模式的他，為了看貓熊而跑到動物園、又或者是為了買冰而去便利商店。","巴哈姆特動畫瘋","","","","","7.24","101K","anime_data/images/休假的壞人先生.jpg"
"https://static.acgsecrets.hk/img/23/23317a3a9f369cd782f47849e1be9a3b/65590572a6bae47d35da4787b1b1a0069619dca3fe78d2dc15de4fafadb07208.jpg","魔都精兵的奴隸","動作","其他名稱：Mato Seihei no Slave、Chained Soldier、魔都精兵的奴隶","日本各地出現了異空間「魔都」──由於只有女性能從魔都的「桃」得到特異的能力，因此便由女兵組成了「魔防隊」。某一天，過著抑鬱生活的男高中生──和倉優希不小心闖進了突發性產生的魔都入口，在那裡，遇到了「魔防隊」第七組的美麗隊長──羽前京香，而她竟向優希宣言：「我要你當我的奴隸。」","木棉花YouTube","木棉花YouTube","巴哈姆特動畫瘋","家長指引","奇幻","6.85","237K","anime_data/images/魔都精兵的奴隸.jpg"
"https://static.acgsecrets.hk/img/33/334388d52f0b57f0ab1d7fc3e9b9c1b5/3747d9cba0787a3915653b729fc08c33b57c8d05fdd310723d90c32a0f6faefa.jpg","治癒魔法的錯誤使用法","動作","其他名稱：治癒魔法の間違った使い方、治癒魔法的錯誤用法、Chiyu Mahou no Machigatta Tsukaikata: Senjou wo Kakeru Kaifuku Youin、The Wrong Way to Use Healing Magic、治愈魔法的错误用法、治愈魔法的错误使用法","在某個下雨天，平凡的高中生‧兔里，和同樣準備返家的學生會長‧鈴音，和同學一樹三個人，竟然在路上被魔法陣給吸進異世界去！在那裡他們得知，鈴音和一樹是勇者，而原以為只是被捲入的兔里，卻是稀有的治癒魔法使？他不但被自稱是救命團團長的羅絲強行帶走，並被迫做了如在地獄裡的嚴格訓練？究竟他們之後的命運會如何呢？","木棉花YouTube","木棉花YouTube","巴哈姆特動畫瘋","奇幻","","7.53","294K","anime_data/images/治癒魔法的錯誤使用法.jpg"
"https://static.acgsecrets.hk/img/8f/8f1d7de002553aaf6a3602536810c454/12a47f0f923f15f7089f60f9bf78f7b65e53e3f4807b55f3c7e2278277cdfa93.jpg","非自願的不死冒險者","動作","其他名稱：事與願違的不死冒險者、Nozomanu Fushi no Boukensha、The Unwanted Undead Adventurer、非自愿的不死冒险者、事与愿违的不死冒险者","以最頂級的神銀級冒險者為目標，轉眼過了十年。仍是區區銅級冒險者的雷特，獨自闖進《水月迷宮》，並在那裡碰到了「巨龍」，結果在壓倒性的力量面前，雷特束手無策地遭對手吞噬。──就這樣，雷特「甦醒了」。然而不知為何，他卻變成了最弱魔物「骨人」的模樣……！？雷特為了避免遭人類剷除，決定將希望寄託在魔物的「存在進化」上－－也就是打倒其他魔物累積經驗，以進化成高階魔物為目標。因為如果能藉由存在進化變成「食屍鬼」，或許就能偽裝成人類。而在這個過程中，雷特巧遇了人類的菜鳥冒險者莉娜。為拯救莉娜而擊敗魔物的雷特，也在同時體會到自己藉由存在進化所得到的力量……！？與強大魔物戰鬥，目睹各種神祕事物，並且讓自己變得更加強大。在死後仍持續朝遙遠的神銀級邁進，不死者雷特的「冒險」就此揭開序幕！","Netflix","木棉花YouTube","Netflix","冒險","奇幻","7.43","204K","anime_data/images/非自願的不死冒險者.jpg"
"https://static.acgsecrets.hk/img/35/35b822053f2a59ede1a5eca605d55b9b/7badf38b0707086bdbacfae06c636e52e45f2ff127c2e54469ef6f093a1e6bda.jpg","夢想成為魔法少女","動作","其他名稱：憧憬成为魔法少女、Mahou Shoujo ni Akogarete、Gushing over Magical Girls、I Admire Magical Girls, and...、梦想成为魔法少女","在一個實際有魔法少女存在，由她們對抗奇異魔物來保護眾人的世界裡，就讀國中2年級的柊舞緹娜，是一個崇拜魔法少女的普通國中女生。在夢想著自己如果也能變身就好的舞緹娜面前，突然出現一個看起來就像是吉祥物的生物，並且說要給她能變身的能力。但沒想到變身之後居然不是魔法少女，而是邪惡組織女幹部。因為變身畫面被錄下而不得不與魔法少女作戰的舞緹娜，慢慢發現自己其實好像不是真的那麼不情願……","巴哈姆特動畫瘋","","","喜劇","家長指引","7.62","189K","anime_data/images/夢想成為魔法少女.jpg"
"https://static.acgsecrets.hk/img/2b/2b7f7b4f73b9009b9c5ab5491cb0308a/e0376151641e9cf142a2ccf7602ed1a7726095a0445bb48dfe3d746e666e9a4b.jpg","因為不是真正的夥伴而被逐出勇者隊伍，流落到邊境展開慢活人生 2nd","動作","其他名稱：因為不是命中注定的同伴而被趕出了勇者的隊伍、從此以後過上了悠閑的隱居生活 2nd、我被逐出隊伍後過上慢生活 2nd、Shin no Nakama ja Nai to Yuusha no Party wo Oidasareta node, Henkyou de Slow Life suru Koto ni Shimashita 2nd、Banished from the Hero's Party, I Decided to Live a Quiet Life in the Countryside 2nd、因为不是真正的伙伴而被逐出勇者队伍， 流落到边境展开慢活人生 2nd、因为不是命中注定的同伴而被赶出了勇者的队伍、从此以后过上了悠闲的隐居生活 2nd、我被逐出队伍后过上慢生活 2nd","打敗強襲而來的賢者艾瑞斯之後，雷德與寶貝妹妹露緹及其摯友媞瑟一起過著幸福的生活。雷德與莉特在這場戰役的尾聲互相許諾終生，他決定前往「世界盡頭之壁」尋找這世上最好的寶石送給莉特，卻在旅途中遇上昔日夥伴！","Bilibili","Bilibili","Bilibili","冒險","奇幻","6.76","144K","anime_data/images/因為不是真正的夥伴而被逐出勇者隊伍，流落到邊境展開慢活人生 2nd.jpg"
"https://static.acgsecrets.hk/img/f4/f4d6009d1addd5cde500fdb00596a8bd/4a35017b527405f46e7ba2e1a72db6d14010db54e063cf48f1e8aae9f85fbeb0.jpg","秒殺外掛太強了，異世界的傢伙們根本就不是對手。","動作","其他名稱：Sokushi Cheat ga Saikyou Sugite, Isekai no Yatsura ga Marude Aite ni Naranaindesu ga.、My Instant Death Ability Is So Overpowered, No One in This Other World Stands a Chance Against Me!、秒杀外挂太强了，异世界的家伙们根本就不是对手。","在學校的旅行中，高遠夜霧和他的同學們突然被召喚到異世界。召喚他們的是一位自稱為賢者的女性，シオン。她給予他們名為《Gift》的特殊能力，並告訴他們必須完成賢者的考驗。即便對這突發狀況感到困惑，所有人仍然決定開始行動。但奇怪的是，夜霧和壇ノ浦知千佳等一些學生沒有獲得《Gift》。他們被當作誘餌，遺留在即將被龍攻擊的草原上。那些被遺留的學生一個接一個地被龍殺死，夜霧和知千佳也陷入了危險。但是……夜霧突然大喝「去死吧」，就擊退了龍。原來，他擁有能立刻殺死任何對象的《秒殺外掛》能力！夜霧和知千佳開始了他們返回原世界的冒險之旅。在他們前方等待著的，是異世界中的其他超能力者。不死的吸血鬼？能重來的勇者？被神寵愛的轉生者？但他們都不是夜霧的《秒殺外掛》的對手！","木棉花YouTube","巴哈姆特動畫瘋","木棉花YouTube","冒險","奇幻","6.36","176K","anime_data/images/秒殺外掛太強了，異世界的傢伙們根本就不是對手。.jpg"
"https://static.acgsecrets.hk/img/d2/d27d041b992b2a9b93a14d3d4afdac24/8699134d9db37558bb798857aac9b65d3848d60120a62dbcba235b3719128553.jpg","指尖相觸，戀戀不捨","浪漫","其他名稱：Yubisaki to Renren、A Sign of Affection、指尖相触，恋恋不舍","「自從與你相遇之後，我的世界出現了開始改變的聲音。」小雪的世界一直是由可愛的東西、朋友、大學、SNS撐到了現在。 有一天她在電車上遇到了外國人向她問路，可小雪沒辦法幫助對方，這時……逸臣先生毫無徵兆地出現在了她的世界裡。 ——「我完全不想知道，中止這份感情的方法。」","木棉花YouTube","木棉花YouTube","巴哈姆特動畫瘋","","","8.2","314K","anime_data/images/指尖相觸，戀戀不捨.jpg"
"https://static.acgsecrets.hk/img/27/272f31e113df7d0521fc57305ea7cb90/6799c760b57df0a44e71d69c66c14ece9752a962b5a99916f2ab42a569ef8a44.jpg","異修羅","動作","其他名稱：Ishura、异修罗","那是魔王遭弒之後的世界。該地遺留眾多足以擊斃魔王的修羅。一眼即能找出殺害對手手段的異世界劍豪、超越音速的神速槍兵、能同時以三隻手臂運用傳說武器的鳥龍冒險者、一句話便能實現所有現象的全能詞術士、身為未知之物，司掌驟死之力的天使暗殺者……來自各方種族，功力已臻至極的修羅們為了尋求更強大的敵人，追求「真正勇者」的榮耀，將會爆發一場嶄新的爭鬥。全員皆為最強，全員皆是英雄，唯有一人能成為勇者。決定「真正勇者」的激烈戰鬥即將揭幕──","Disney＋","Disney＋","Bilibili","冒險","奇幻","6.72","125K","anime_data/images/異修羅.jpg"
"https://static.acgsecrets.hk/img/f5/f5dff6880f7fc937ea3fba12c335553b/69066e7fcbfb346841c9b8c3393a56e8d5dd2fb21b53764325cd53916d6e0589.jpg","為了在異世界也能撫摸毛茸茸而努力。","冒險","其他名稱：為了在異世界也能撫摸毛茸茸而努力著。、Isekai de Mofumofu Nadenade suru Tame ni Ganbattemasu.、Fluffy Paradise at the Isekai, I'm trying to do my best、为了在异世界也能抚摸毛茸茸而努力着。、为了在异世界也能抚摸毛茸茸而努力","秋津みどり死於過勞後重生，被神授予一項特殊能力——能夠得到非人類生物的喜愛。她轉生為高規格貴族最小的女兒，名為ネフェルティマ・オスフェ，暱稱ネマ（三歲）。在那裡，她受到各種毛茸茸生物的愛戴，甚至可以自由地撫摸白虎和龍！今天，ネマ依然在「毛茸茸」「撫摸」中得到治愈，同時為了人類的存續（？）而奮鬥！","Crunchyroll","Crunchyroll","","奇幻","日常","6.78","90K","anime_data/images/為了在異世界也能撫摸毛茸茸而努力。.jpg"
"https://static.acgsecrets.hk/img/9f/9fbac9fa6e2c84a468b48d04f5c50dd9/4b376b54d21f1aa49ebb153ada12b527a166184ef06ee8db56a749794dde9a3d.jpg","女王的手術刀","喜劇","其他名稱：Surgeon Elise、Gekai Elise、Doctor Elise、外科医生爱丽丝、女王的手术刀","高本葵的前世是「悪女皇后」エリーゼ。她的所作所為為眾多下民帶來痛苦，最後由於其罪行被丈夫リンデン處以死刑。在這世，她為了彌補前世的過錯而成為一名外科醫生，不幸的是，她在一次飛機事故中喪命。驚訝地，當她再次醒來，她回到了那災難性的前世，回到被處刑的十年前，並再次遇到因她而喪命的家人。她不想再失去親近的人，決心在這第三世避免和リンデン的婚約，並利用她的醫學知識再次成為一名醫生。","Aniplus","巴哈姆特動畫瘋","","奇幻","浪漫","7.26","109K","anime_data/images/女王的手術刀.jpg"
"https://static.acgsecrets.hk/img/49/49407e40ad2081c2c9f64d1054ed4c7b/5ed49c97293fe5974a6221bb62d87061ced4ee360f6567103273395c9db6a55c.jpg","勇氣爆發Bang Bravern","動作","其他名稱：Yuuki Bakuhatsu Bang Bravern、Bang Brave Bang Bravern、勇气爆发Bang Bravern","——連繫他們的是「勇氣」在人型裝甲兵器『ティタノストライド(通稱TS)』盛行的時代，各國軍隊集結在「夏威夷Oahu島」。陸上自衛隊的「碧勇」與美國海軍陸戰隊的「Lewis Smith」在戰鬥之中邂逅。不明身份的敵人突然襲擊，士兵們陸續陣亡。為了自己的榮譽而戰。為了在死亡四伏的戰場上生存下來。為了拯救同伴。相信生命，讓「勇氣」熾熱燃燒。","Aniplus","巴哈姆特動畫瘋","","科幻","","7.54","35K","anime_data/images/勇氣爆發Bang Bravern.jpg"
"https://static.acgsecrets.hk/img/3c/3c8e6b1e43cd85ffa0b433f1a915276e/ff1c3c7922348558ce2d619bb65426bc30e9017710c6005f1503e38c7631b9cb.jpg","北海道辣妹金古錐","喜劇","其他名稱：北海道辣妹賊拉可愛、Dosanko Gal wa Namara Menkoi、Hokkaido Gals Are Super Adorable!、北海道辣妹贼拉可爱、北海道辣妹金古锥","原本生活在東京的高中生˙四季翼，因為家庭因素的關係，搬家到偏僻的北海道北見市。在這個生活環境、生活步調與東京都完全不同的北方大地，他遇見了「北海道辣妹」冬木美波。美波對這位來自大都市的好朋友非常地友善，而且攻勢也非常地積極，讓小翼漸漸開始對美波動心。青澀都市少年與北海道辣妹之間的戀情，就此展開！","Crunchyroll","Crunchyroll","","","","7.04","204K","anime_data/images/北海道辣妹金古錐.jpg"
"https://static.acgsecrets.hk/img/3a/3ab11c72f1573d9b3848f04575d8f46b/ee2aef18b495df15381097bc1ab832a223ad983af152e1f4d85fed85ad6801e9.jpg","佐佐木與文鳥小嗶","冒險","其他名稱：Sasaki to Pii-chan、Sasaki and Peeps、佐佐木与文鸟小哔","在寵物店買的可愛文鳥竟是從異世界轉生而來的著名賢者。佐佐木被賦予了超越世界的機會和強大的魔法力量，開始將現代物品帶到異世界進行買賣。在世界之間來回穿梭──賺賺錢、做做魔法訓練，偶爾品嚐美食──以如此悠然愜意的生活為目標。然而，某天他卻在從公司回家的路上，遇到了異能力者。儘管憑著得自賢者的魔法解決了異能戰鬥，卻使得他的實力受到注目，因而被內閣府超常現象對策局挖角，決定轉行成為國家公務員……？","viu.com","巴哈姆特動畫瘋","木棉花YouTube","喜劇","奇幻","6.84","112K","anime_data/images/佐佐木與文鳥小嗶.jpg"
"https://static.acgsecrets.hk/img/b6/b6a565aa7c9194cd433d2023ae47991f/b7f594a067cb373c2e6b641dd0cef8eafd47818a31d921a89af1f927790cb53d.jpg","愚蠢天使與惡魔共舞","喜劇","其他名稱：Oroka na Tenshi wa Akuma to Odoru、The Foolish Angel Dances with the Devil、愚蠢天使与恶魔共舞","為了讓面臨存亡關頭的魔界惡魔們重拾幹勁，阿久津雅虎被指派前往人類世界尋找具備偶像特質的人。阿久津以轉學生身分進入校園，發現班上的美少女天音具備成為精神領導者的特質，不料天音真正的身分竟然是惡魔的天敵「天使」！於是一場互相征服的腹黑戀愛喜劇開幕！","Ani-One YouTube","Ani-One YouTube","巴哈姆特動畫瘋","超自然","","6.91","138K","anime_data/images/愚蠢天使與惡魔共舞.jpg"
"https://static.acgsecrets.hk/img/7a/7a571ff958be320c9e799fa1d2ef573a/3df780b8f37c65cb98799035cbcf4fc5c9fefbac358a8590889d845e74655cbe.jpg","反派千金等級99","奇幻","其他名稱：悪役令嬢レベル99 ～私は裏ボスですが魔王ではありません～、反派千金等級99～我是隱藏頭目但不是魔王～、惡役千金等級99、Akuyaku Reijou Level 99: Watashi wa Ura-Boss desu ga Maou dewa Arimasen、Villainess Level 99: I May Be the Hidden Boss but I'm Not the Demon Lord、反派千金等级99、反派千金等级99～我是隐藏头目但不是魔王～、恶役千金Lv.99","我轉生成了RPG類型女性向遊戲中的反派千金尤蜜拉。不小心燃起身為遊戲玩家的鬥志，努力鍛鍊之後，導致我的等級在進入學園就讀時就已經達到了99級。本來還希望能夠不跟遊戲主線扯上關係，盡量避免引人注目，過著平穩的生活，沒想到等級在剛入學時就曝了光，遭到女主角、攻略對象等人懷疑是魔王……!?","Aniplus","巴哈姆特動畫瘋","","","","7.13","192K","anime_data/images/反派千金等級99.jpg"
"https://static.acgsecrets.hk/img/27/2768a7423ca26c395de5651897163e5c/01ce45ec2a9dd632c29757374f57365ef029d0d558bab136b52641360fa90530.jpg","到了30歲還是處男，似乎會變成魔法師","喜劇","其他名稱：30-sai made Doutei dato Mahoutsukai ni Nareru Rashii、Cherry Magic! Thirty Years of Virginity Can Make You a Wizard?!、到了30岁还是处男，似乎会变成魔法师","由於安達30歲了還保有處男之身，因此變得能使用魔法。他得到的是「只要接觸就能讀取人心」這般多餘又樸素的魔法之力。這樣的某日，他無意間讀取到工作優秀的同期帥哥同事──黑澤的心，黑澤的心中，充滿了對安達的無限愛戀!?","Ani-One YouTube","Ani-One YouTube","巴哈姆特動畫瘋","超自然","","7.64","84K","anime_data/images/到了30歲還是處男，似乎會變成魔法師.jpg"
"https://static.acgsecrets.hk/img/eb/ebadf6fa36c6e822261cb4aefcc20db8/e46678eba2b30e0fafe5aca2b36592e6b7852a3096bbcbf4735fcbfa7396ae18.jpg","青之祓魔師 島根啓明結社篇","動作","其他名稱：Ao no Exorcist Shimane Illuminati-hen、Blue Exorcist -Shimane Illuminati Saga-、青之驱魔师 岛根启明结社篇、青之祓魔师 岛根启明结社篇","","愛奇藝","愛奇藝","巴哈姆特動畫瘋","奇幻","","7.1","174K","anime_data/images/青之祓魔師 島根啓明結社篇.jpg"
